{
  "schemaVersion": 1,
  "sdkContractVersion": {"major": 1, "minor": 0},
  "id": "com.example.hello",
  "version": "1.0.0",
  "origin": "third-party",
  "displayName": {"en-US": "Hello"},
  "supportedLocales": ["en-US"],
  "entrypoint": {"kind": "native", "target": "bin/hello.napp"},
  "resources": [],
  "intents": [],
  "requestedCapabilities": [],
  "stateCompatibility": {"currentVersion": 1, "minimumReadableVersion": 1},
  "extensions": {
    "org.nagi.app-lifecycle": {"schemaVersion": 1}
  }
}
